{
  "c0_contract_wire_sha256": "2ae93b68cc46be4824d2f97c2ef7e159bfb8a19ed768f71a4ba9a67b99a25c3d",
  "c0_contract_wire_utf8_base64": "eyJmcm96ZW5fdHJhY2UiOnsiZGF0YV9zbmFwc2hvdF9pZCI6IjQ0NDQ0NDQ0NDQ0NDQ0NDQ0NDQ0NDQ0NDQ0NDQ0NDQ0NDQ0NDQ0NDQ0NDQ0NDQ0NDQ0NDQ0NDQ0NDQ0NDQ0NDQiLCJmcmFtZXMiOlt7ImV4cGVjdGVkX3N0YXRlX3VuaXRzIjo3LCJvcGVyYW5kX3VuaXRzIjo3LCJvcGVyYXRpb24iOiJBQ0NVTVVMQVRFIiwic2VxdWVuY2UiOjB9LHsiZXhwZWN0ZWRfc3RhdGVfdW5pdHMiOjQsIm9wZXJhbmRfdW5pdHMiOi0zLCJvcGVyYXRpb24iOiJBQ0NVTVVMQVRFIiwic2VxdWVuY2UiOjF9LHsiZXhwZWN0ZWRfc3RhdGVfdW5pdHMiOjksIm9wZXJhbmRfdW5pdHMiOjUsIm9wZXJhdGlvbiI6IkFDQ1VNVUxBVEUiLCJzZXF1ZW5jZSI6Mn1dLCJwYWNrYWdlX2lkIjoiMjZmMmFkZDJkNzE0NWE3YmZmNGQzMDk1YzRmMDEzMTQyNzY1NmYwYTI5MzVlZWQwYjg1YjY2NmYzMmUxMTk5MyIsInRyYWNlX2lkIjoiMzY5NTgwOThmYTg0NTEyZDk2YjMwOWUyZWY4YjZiZjBjYTQ2MDJjODIxOWMwNjVmYWE4NTJhZGU3MTdlNDczZiJ9LCJzY2hlbWFfdmVyc2lvbiI6MSwic3RyYXRlZ3lfY2FuZGlkYXRlIjp7ImNhbmRpZGF0ZV9pZCI6ImJiZDdkYTAwMDBjNmQ0MTc0YzlhMGNlNGE1ODQ4MDMyMWIxMTZiMTkxNzAyYzZmNDQwYjI1Njg3MzM0OTAyMjIiLCJjb2RlX3NoYTI1NiI6IjExMTExMTExMTExMTExMTExMTExMTExMTExMTExMTExMTExMTExMTExMTExMTExMTExMTExMTExMTExMTExMTEiLCJjb25maWdfc2hhMjU2IjoiMjIyMjIyMjIyMjIyMjIyMjIyMjIyMjIyMjIyMjIyMjIyMjIyMjIyMjIyMjIyMjIyMjIyMjIyMjIyMjIyMjIyMiIsImRhdGFfc25hcHNob3RfaWQiOiI0NDQ0NDQ0NDQ0NDQ0NDQ0NDQ0NDQ0NDQ0NDQ0NDQ0NDQ0NDQ0NDQ0NDQ0NDQ0NDQ0NDQ0NDQ0NDQ0NDQ0NDQ0IiwiZXhwZXJpbWVudF9ydW5faWQiOiIxZTU1YzBiYTA5MDFlZDAwZDZiMzM2YTM1Y2Y0ZGRjNGRjZTQyZTBkMTdmNjI3ZTAzZmNlZGQ5YmE4MmM4NDA0IiwicGFyYW1ldGVyX3ZlY3RvciI6W3sibmFtZSI6ImRlY2lzaW9uX3RocmVzaG9sZF91bml0cyIsInZhbHVlIjo1fV0sInN0cmF0ZWd5X2ZhbWlseV9pZCI6ImdlbmVyaWMtYWNjdW11bGF0b3ItdjEifSwic3RyYXRlZ3lfcGFja2FnZSI6eyJjYW5kaWRhdGVfaWQiOiJiYmQ3ZGEwMDAwYzZkNDE3NGM5YTBjZTRhNTg0ODAzMjFiMTE2YjE5MTcwMmM2ZjQ0MGIyNTY4NzMzNDkwMjIyIiwiY29zdF9sYXRlbmN5X3Byb2ZpbGUiOnsiaWRlYWxpemVkX2Nvc3RfYnBzIjowLCJpZGVhbGl6ZWRfbGF0ZW5jeV9ldmVudHMiOjAsInJlYWxpc3RpY19jb3N0X2JwcyI6NywicmVhbGlzdGljX2xhdGVuY3lfZXZlbnRzIjoxLCJzdHJlc3NlZF9jb3N0X2JwcyI6MjEsInN0cmVzc2VkX2xhdGVuY3lfZXZlbnRzIjozfSwiZXhlY3V0aW9uX2NhcGFiaWxpdHkiOiJSRVNFQVJDSF9TSU1VTEFUSU9OX09OTFkiLCJpbml0aWFsX3N0YXRlX3VuaXRzIjowLCJrZXJuZWxfaWQiOiJnZW5lcmljLWFjY3VtdWxhdG9yLXYxIiwibWF4X2Fic19zdGF0ZV91bml0cyI6MTAwMDAwMCwicGFja2FnZV9pZCI6IjI2ZjJhZGQyZDcxNDVhN2JmZjRkMzA5NWM0ZjAxMzE0Mjc2NTZmMGEyOTM1ZWVkMGI4NWI2NjZmMzJlMTE5OTMifX0=",
  "mapping_version": 1,
  "materialization_id": "9513176db3ac26eac59407ced49e507e2ef09d30cff52692decb921957ae461d",
  "r1_source": {
    "candidate_canonical_utf8_base64": "eyJjYW5kaWRhdGVfaWQiOiJlN2RjYWQzZmU4OWRiOWM1M2YwMTc1Y2NjODBhMzdiNzA4YjZjMDk0MDg5ZWM1ZDM5NzQxNzExMTk4Yzg2YWEzIiwiY29kZV9zaGEyNTYiOiIxMTExMTExMTExMTExMTExMTExMTExMTExMTExMTExMTExMTExMTExMTExMTExMTExMTExMTExMTExMTExMTExIiwiY29uZmlnX3NoYTI1NiI6IjIyMjIyMjIyMjIyMjIyMjIyMjIyMjIyMjIyMjIyMjIyMjIyMjIyMjIyMjIyMjIyMjIyMjIyMjIyMjIyMjIyMjIiLCJmZWF0dXJlX3NoYTI1NiI6IjMzMzMzMzMzMzMzMzMzMzMzMzMzMzMzMzMzMzMzMzMzMzMzMzMzMzMzMzMzMzMzMzMzMzMzMzMzMzMzMzMzMzMiLCJzY29yZV91bml0cyI6MTUsInNlbGVjdGVkX2V2ZW50X2NvdW50IjozLCJzbmFwc2hvdF9pZCI6IjQ0NDQ0NDQ0NDQ0NDQ0NDQ0NDQ0NDQ0NDQ0NDQ0NDQ0NDQ0NDQ0NDQ0NDQ0NDQ0NDQ0NDQ0NDQ0NDQ0NDQ0NDQiLCJzdHJhdGVneV9mYW1pbHlfaWQiOiJnZW5lcmljLWFjY3VtdWxhdG9yLXYxIiwidGhyZXNob2xkX3VuaXRzIjo1LCJ2ZXJzaW9uIjoicjEtc2NyZWVuaW5nLWNhbmRpZGF0ZS12MSJ9",
    "candidate_id": "e7dcad3fe89db9c53f0175ccc80a37b708b6c094089ec5d39741711198c86aa3",
    "candidate_raw_sha256": "aafe80985f85122b297f4c731345398f65986f27bbef32ceb66b2345e02cbd3d",
    "manifest_canonical_utf8_base64": "eyJjYW5kaWRhdGVfaWRzIjpbImU3ZGNhZDNmZTg5ZGI5YzUzZjAxNzVjY2M4MGEzN2I3MDhiNmMwOTQwODllYzVkMzk3NDE3MTExOThjODZhYTMiXSwiY2FuZGlkYXRlX21ldHJpY3MiOlt7ImNhbmRpZGF0ZV9pZCI6ImU3ZGNhZDNmZTg5ZGI5YzUzZjAxNzVjY2M4MGEzN2I3MDhiNmMwOTQwODllYzVkMzk3NDE3MTExOThjODZhYTMiLCJyYW5rIjowLCJzY29yZV91bml0cyI6MTUsInNlbGVjdGVkX2V2ZW50X2NvdW50IjozLCJ0aHJlc2hvbGRfdW5pdHMiOjV9XSwiY29kZV9zaGEyNTYiOiIxMTExMTExMTExMTExMTExMTExMTExMTExMTExMTExMTExMTExMTExMTExMTExMTExMTExMTExMTExMTExMTExIiwiY29uZmlnX3NoYTI1NiI6IjIyMjIyMjIyMjIyMjIyMjIyMjIyMjIyMjIyMjIyMjIyMjIyMjIyMjIyMjIyMjIyMjIyMjIyMjIyMjIyMjIyMjIiLCJmZWF0dXJlX3NoYTI1NiI6IjMzMzMzMzMzMzMzMzMzMzMzMzMzMzMzMzMzMzMzMzMzMzMzMzMzMzMzMzMzMzMzMzMzMzMzMzMzMzMzMzMzMzMiLCJyb3dfY291bnQiOjIzLCJzY3JlZW5pbmdfbWFuaWZlc3RfaWQiOiIzNmM2MmVjY2QxMDk2NDExZTQ3NmM0MWExYzQzYzZhZjlkOTFlZjNiOWY1NmRiZDc1YTZhM2E0NDNhZjU0NWU1Iiwic2VsZWN0ZWRfY2FuZGlkYXRlX2lkIjoiZTdkY2FkM2ZlODlkYjljNTNmMDE3NWNjYzgwYTM3YjcwOGI2YzA5NDA4OWVjNWQzOTc0MTcxMTE5OGM4NmFhMyIsInNuYXBzaG90X2lkIjoiNDQ0NDQ0NDQ0NDQ0NDQ0NDQ0NDQ0NDQ0NDQ0NDQ0NDQ0NDQ0NDQ0NDQ0NDQ0NDQ0NDQ0NDQ0NDQ0NDQ0NDQ0NCIsInN0cmF0ZWd5X2ZhbWlseV9pZCI6ImdlbmVyaWMtYWNjdW11bGF0b3ItdjEiLCJ0cmFjZV9pZCI6IjdlMjRlZjkzNDMwYmFhMzUzMzhjNzU2MjQwMDVjZmM3ZTU4YjliNGJlY2FhOWJlODI3OGUyMzgxZGI0MzUyZmEiLCJ2ZXJzaW9uIjoicjEtdmVjdG9yaXplZC1zY3JlZW5pbmctdjEifQ==",
    "manifest_raw_sha256": "d68161bc29d3f7fc49066c4b6ad876e1ef3d91636764c5c57819bb3d70cae819",
    "screening_manifest_id": "36c62eccd1096411e476c41a1c43c6af9d91ef3b9f56dbd75a6a3a443af545e5",
    "trace_canonical_utf8_base64": "eyJjYW5kaWRhdGVfaWQiOiJlN2RjYWQzZmU4OWRiOWM1M2YwMTc1Y2NjODBhMzdiNzA4YjZjMDk0MDg5ZWM1ZDM5NzQxNzExMTk4Yzg2YWEzIiwiZnJhbWVzIjpbeyJleHBlY3RlZF9zdGF0ZV91bml0cyI6Nywib3BlcmFuZF91bml0cyI6Nywic2VxdWVuY2UiOjAsInNvdXJjZV9zZXF1ZW5jZSI6MTB9LHsiZXhwZWN0ZWRfc3RhdGVfdW5pdHMiOjQsIm9wZXJhbmRfdW5pdHMiOi0zLCJzZXF1ZW5jZSI6MSwic291cmNlX3NlcXVlbmNlIjoxNX0seyJleHBlY3RlZF9zdGF0ZV91bml0cyI6OSwib3BlcmFuZF91bml0cyI6NSwic2VxdWVuY2UiOjIsInNvdXJjZV9zZXF1ZW5jZSI6MjJ9XSwic25hcHNob3RfaWQiOiI0NDQ0NDQ0NDQ0NDQ0NDQ0NDQ0NDQ0NDQ0NDQ0NDQ0NDQ0NDQ0NDQ0NDQ0NDQ0NDQ0NDQ0NDQ0NDQ0NDQ0NDQ0IiwidHJhY2VfaWQiOiI3ZTI0ZWY5MzQzMGJhYTM1MzM4Yzc1NjI0MDA1Y2ZjN2U1OGI5YjRiZWNhYTliZTgyNzhlMjM4MWRiNDM1MmZhIiwidmVyc2lvbiI6InIxLWZyb3plbi1zaW11bGF0aW9uLXRyYWNlLXYxIn0=",
    "trace_id": "7e24ef93430baa35338c75624005cfc7e58b9b4becaa9be8278e2381db4352fa",
    "trace_raw_sha256": "ad3d0ccb49903c8389a4d09b9d05aec3f70bb0a1aaf1ccbd9a9458faaef6e351"
  },
  "r1_source_bundle_sha256": "ace6e9bd88853e1c3d0409fec331466d02ee844389b01258903f665fd27672f1"
}
